{
  "schema_version": "goreecloud.health.record.v1",
  "record_id": "synthetic.active-time.20260911.001",
  "record_type": "activity.active-time",
  "interval": {
    "start_time": "2026-09-11T09:00:00-05:00",
    "end_time": "2026-09-11T10:00:00-05:00",
    "time_zone": "America/Chicago",
    "utc_offset_minutes": -300
  },
  "source": {
    "source_id": "synthetic.fixture",
    "source_kind": "synthetic",
    "source_record_id": "active-time-001"
  },
  "provenance": {
    "ingest_method": "synthetic-fixture",
    "observed_at": "2026-09-11T14:05:00Z",
    "transformed": false
  },
  "lifecycle": {"status": "active"},
  "payload": {"value": 1500, "unit": "s"}
}
