{
  "schema_version": "goreecloud.health.record.v1",
  "record_id": "synthetic.activity-intensity.20260911.001",
  "record_type": "activity.intensity",
  "interval": {
    "start_time": "2026-09-11T18:00:00-05:00",
    "end_time": "2026-09-11T18:30:00-05:00",
    "time_zone": "America/Chicago",
    "utc_offset_minutes": -300
  },
  "source": {"source_id": "synthetic.fixture", "source_kind": "synthetic", "source_record_id": "activity-intensity-001"},
  "provenance": {"ingest_method": "synthetic-fixture", "observed_at": "2026-09-11T23:35:00Z", "transformed": false},
  "lifecycle": {"status": "active"},
  "payload": {"level": "moderate"}
}
