{
  "schema_version": "goreecloud.health.record.v1",
  "record_id": "synthetic.height.20260911.001",
  "record_type": "body.height",
  "interval": {
    "start_time": "2026-09-11T08:00:00-05:00",
    "time_zone": "America/Chicago",
    "utc_offset_minutes": -300
  },
  "source": {"source_id": "synthetic.fixture", "source_kind": "synthetic", "source_record_id": "height-001"},
  "provenance": {"ingest_method": "synthetic-fixture", "observed_at": "2026-09-11T13:01:00Z", "transformed": false},
  "lifecycle": {"status": "active"},
  "payload": {"value": 1.73, "unit": "m"}
}
