{
  "schema_version": "goreecloud.health.record.v1",
  "record_id": "synthetic.sleep.staged.20260909.001",
  "record_type": "sleep.session",
  "interval": {
    "start_time": "2026-09-08T22:30:00-05:00",
    "end_time": "2026-09-09T06:30:00-05:00",
    "time_zone": "America/Chicago",
    "utc_offset_minutes": -300
  },
  "source": {"source_id": "synthetic.fixture", "source_kind": "synthetic", "source_record_id": "sleep-staged-001"},
  "provenance": {"ingest_method": "synthetic-fixture", "observed_at": "2026-09-09T12:05:00Z", "transformed": false},
  "lifecycle": {"status": "active"},
  "payload": {
    "stages": [
      {"start_time": "2026-09-08T22:30:00-05:00", "end_time": "2026-09-08T22:45:00-05:00", "stage": "awake-in-bed"},
      {"start_time": "2026-09-08T22:45:00-05:00", "end_time": "2026-09-08T23:30:00-05:00", "stage": "light"},
      {"start_time": "2026-09-08T23:30:00-05:00", "end_time": "2026-09-09T00:30:00-05:00", "stage": "deep"},
      {"start_time": "2026-09-09T00:30:00-05:00", "end_time": "2026-09-09T01:00:00-05:00", "stage": "light"},
      {"start_time": "2026-09-09T01:00:00-05:00", "end_time": "2026-09-09T01:30:00-05:00", "stage": "rem"},
      {"start_time": "2026-09-09T01:30:00-05:00", "end_time": "2026-09-09T02:30:00-05:00", "stage": "sleeping"},
      {"start_time": "2026-09-09T02:30:00-05:00", "end_time": "2026-09-09T02:40:00-05:00", "stage": "awake"},
      {"start_time": "2026-09-09T02:40:00-05:00", "end_time": "2026-09-09T04:00:00-05:00", "stage": "light"},
      {"start_time": "2026-09-09T04:00:00-05:00", "end_time": "2026-09-09T05:00:00-05:00", "stage": "deep"},
      {"start_time": "2026-09-09T05:00:00-05:00", "end_time": "2026-09-09T06:00:00-05:00", "stage": "rem"},
      {"start_time": "2026-09-09T06:00:00-05:00", "end_time": "2026-09-09T06:10:00-05:00", "stage": "out-of-bed"},
      {"start_time": "2026-09-09T06:10:00-05:00", "end_time": "2026-09-09T06:30:00-05:00", "stage": "unknown"}
    ]
  }
}
